{
  "permission_id": "perm-q7r8s9t0",
  "granted_to": "cognitive-pipeline-planner-01",
  "scope": {
    "resource": "tool:email",
    "action": "read",
    "constraints": {
      "allowed_fields": [
        "subject",
        "from",
        "date"
      ],
      "excluded_fields": [
        "body",
        "attachments"
      ]
    }
  },
  "audience": "tool:email",
  "ttl_seconds": 60,
  "effective_at": "2026-04-18T14:30:01Z",
  "expires_at": "2026-04-18T14:31:01Z",
  "one_shot": true,
  "forwardable": false,
  "granted_by": "policy:compliance-email-001",
  "policy_ref": "compliance-email-001",
  "request_ref": "req-a1b2c3d4",
  "decision_ref": "dec-i9j0k1l2",
  "status": "consumed",
  "consumed_at": "2026-04-18T14:30:02Z"
}
